### ISSUE TITLE
Bogus(?) SrcPort randomization

### ISSUE THREAD

**Issue by darkk** [radioegor146/ntpd-exporter#1]
Is it intentional that every control message is sent with it's own SrcPort? It's, probably, not a big deal, however, using separate SrcPort for every sub-transaction kinda violates principle of the least astonishment.

Here is a snippet from `/root/ntpd-exporter-ntpq.pcap` at `timekeeper.int.bksp.in`:

```
11:15:10.176788 IP 10.0.2.100.49131 > 10.0.2.123.123: NTPv2, Control Message, length 16
11:15:10.176897 IP 10.0.2.123.123 > 10.0.2.100.49131: NTPv2, Control Message, length 36
11:15:10.176913 IP 10.0.2.100.47793 > 10.0.2.123.123: NTPv2, Control Message, length 16
11:15:10.176979 IP 10.0.2.123.123 > 10.0.2.100.47793: NTPv2, Control Message, length 360
11:15:10.177553 IP 10.0.2.100.50994 > 10.0.2.123.123: NTPv2, Control Message, length 168
11:15:10.177596 IP 10.0.2.100.35276 > 10.0.2.123.123: NTPv2, Control Message, length 152
11:15:10.177635 IP 10.0.2.123.123 > 10.0.2.100.50994: NTPv2, Control Message, length 252
11:15:10.177672 IP 10.0.2.123.123 > 10.0.2.100.35276: NTPv2, Control Message, length 272
11:15:10.178058 IP 10.0.2.100.41695 > 10.0.2.123.123: NTPv2, Control Message, length 16
11:15:10.178098 IP 10.0.2.100.38465 > 10.0.2.123.123: NTPv2, Control Message, length 16
11:15:10.178135 IP 10.0.2.123.123 > 10.0.2.100.41695: NTPv2, Control Message, length 480
11:15:10.178157 IP 10.0.2.123.123 > 10.0.2.100.41695: NTPv2, Control Message, length 200
11:15:10.178210 IP 10.0.2.123.123 > 10.0.2.100.38465: NTPv2, Control Message, length 480
11:15:10.178230 IP 10.0.2.123.123 > 10.0.2.100.38465: NTPv2, Control Message, length 180
11:15:10.178470 IP 10.0.2.100.44104 > 10.0.2.123.123: NTPv2, Control Message, length 16
11:15:10.178510 IP 10.0.2.100.60350 > 10.0.2.123.123: NTPv2, Control Message, length 16
11:15:10.178537 IP 10.0.2.123.123 > 10.0.2.100.44104: NTPv2, Control Message, length 480
11:15:10.178557 IP 10.0.2.123.123 > 10.0.2.100.44104: NTPv2, Control Message, length 200
11:15:10.178629 IP 10.0.2.123.123 > 10.0.2.100.60350: NTPv2, Control Message, length 480
11:15:10.178649 IP 10.0.2.123.123 > 10.0.2.100.60350: NTPv2, Control Message, length 200
11:15:10.178785 IP 10.0.2.100.54837 > 10.0.2.123.123: NTPv2, Control Message, length 16
11:15:10.178828 IP 10.0.2.100.33975 > 10.0.2.123.123: NTPv2, Control Message, length 16
11:15:10.178854 IP 10.0.2.123.123 > 10.0.2.100.54837: NTPv2, Control Message, length 480
11:15:10.178874 IP 10.0.2.123.123 > 10.0.2.100.54837: NTPv2, Control Message, length 200
11:15:10.178925 IP 10.0.2.123.123 > 10.0.2.100.33975: NTPv2, Control Message, length 480
11:15:10.178948 IP 10.0.2.123.123 > 10.0.2.100.33975: NTPv2, Control Message, length 176
```
